,category,service,link,info
67,Образование,Прием документов для зачисления в 1 класс,/cms/ru/online-services/for_citizen/pass_mp_203,"Результат оказания услуги
При обращении на портал:
Уведомление об оказании государственной услуги «Прием документов и зачисление в организации образования (начальные, основные средние, общие средние, специальные)», или мотивированный ответ об отказе в оказании государственной услуги направляется услугополучателю в «личный кабинет» в форме электронного документа, удостоверенного ЭЦП должностного лица услугодателя.
При зачислении в 1 класс с 25 августа будет направлено уведомление в личный кабинет портала «электронного правительства» и СМС-уведомление на номер мобильного телефона услугополучателя о необходимости подписания электронного договора об оказании образовательных услуг организаций среднего образования.
При выборе услуг в композите:
Уведомление о предоставлении бесплатного и льготного питания в общеобразовательной школе либо мотивированный ответ об отказе в оказании государственной услуги, направляется услугополучателю в «личный кабинет» в форме электронного документа, удостоверенного ЭЦП должностного лица услугодателя.
Уведомление о предоставлении бесплатного подвоза к общеобразовательной организации образования и обратно домой, либо мотивированный ответ об отказе в оказании государственной услуги направляется услугополучателю в «личный кабинет» в форме электронного документа, удостоверенного ЭЦП должностного лица услугодателя.
"
68,Образование,Прием документов для перевода детей из школы в школу ,/cms/ru/online-services/for_citizen/pass_30_17_mp,"Результат оказания услуги
Уведомление об оказании государственной услуги «Прием документов для перевода детей между организациями начального, основного среднего, общего среднего образования», либо уведомление об отказе в оказании государственной услуги с мотивированным ответом.
Уведомление о предоставлении бесплатного подвоза к общеобразовательной организации образования и обратно домой, либо мотивированный ответ об отказе в оказании государственной услуги.

"
69,Образование,Прием документов для прохождения аттестации педагогов,/cms/ru/online-services/for_citizen/certification_1,"Результат оказания услуги
При обращении к услугодателю выдача расписки о приеме заявления для присвоения (подтверждения) квалификационной категории педагогам, по форме, либо мотивированный отказ в оказании государственной услуги.
В Государственной корпорации выдача готовых документов осуществляется на основании расписки о приеме соответствующих документов, при предъявлении документа удостоверяющий личность (либо его представителя по нотариально удостоверенной доверенности).
Документы, не выданные в срок из-за отсутствия обращения заявителя (представителя), в течение одного месяца хранятся в Государственной корпорации, после истечения данного срока возвращаются услугодателю как невостребованные. При обращении услугополучателю по истечении одного месяца, по запросу Государственной корпорации услугодатель в течение одного рабочего дня направляет готовые документы в Государственную корпорацию для выдачи услугополучателю.
При обращении через портал уведомление о приеме документов, либо мотивированный отказ в дальнейшем рассмотрении заявления, подписанная ЭЦП услугодателя, отражается в личном кабинете заявителя.
"
70,Образование,Прием документов для участия в конкурсе на назначение первых руководителей государственных организаций образования,/cms/ru/online-services/for_citizen/konkurs_1,"Результат оказания услуги
При оказании государственной услуги бумажно - выдача расписки о приеме документов на участие в конкурсе по форме, либо мотивированный отказ в оказании государственной услуги.
При обращении электронно в ""личный кабинет"" услугополучателя приходит уведомление о приеме документов на участие в конкурсе в форме электронного документа, подписанного ЭЦП уполномоченного лица услугодателя либо мотивированный отказ
"
71,Образование,Прием документов для участия в конкурсе на обучение за рубежом в рамках академической мобильности,/cms/ru/online-services/for_citizen/pass203_mon,"Результат оказания услуги
Расписка о приеме документов к участию в конкурсе на обучение за рубежом, в том числе в рамках академической мобильности.
"
72,Образование,Прием документов для участия в конкурсе на обучение за рубежом в рамках международных договоров в области образования,/cms/ru/online-services/for_citizen/pass_203_mon,"Результат оказания услуги
Расписка о приеме документов к участию в конкурсе на обучение за рубежом в рамках международных договоров в области образования либо мотивированный ответ об отказе в оказании государственной услуги.
"
73,Образование,"Прием документов для участия в конкурсе на присуждение международной стипендии ""Болашак""",/cms/ru/online-services/for_citizen/184pass_mon,"Результат оказания услуги
Расписка о допуске к участию в конкурсе или о направлении документов для рассмотрения в индивидуальном порядке в Министерство либо мотивированный ответ об отказе.

"
74,Образование,Прием документов для участия в конкурсе на прохождение научных стажировок,/cms/ru/online-services/for_citizen/pass474_mon,"Результат оказания услуги
Уведомление о допуске к участию в конкурсе или о направлении документов для рассмотрения в индивидуальном порядке в Министерство либо мотивированный ответ об отказе.
"
75,Образование,Прием документов и зачисление в организации высшего и (или) послевузовского образования для обучения по образовательным программам высшего образования,/cms/ru/online-services/for_citizen/pass_pryem1,"Результат оказания услуги
при обращении услугодателю и в ГО:
при обращении на портал:
"
76,Образование,Прием документов и зачисление в организации высшего и (или) послевузовского образования для обучения по образовательным программам послевузовского образования,/cms/ru/online-services/for_citizen/193pass_mon,"Результат оказания услуги
Выдача расписки о приеме документов по форме, утвержденной приказом № 39 и приказ о зачислении в ОВПО, прошедших конкурсный отбор по итогам вступительных экзаменов до 28 августа календарного года.
"
77,Образование,"Прием документов и зачисление в организации образования (начальные, основные средние, общие средние, специальные)",/cms/ru/online-services/for_citizen/mon-197-205,"Результат оказания услуги
При обращении на портал:
При обращении в ГО:
"
78,Образование,Прием документов и зачисление детей в дошкольные организации,/cms/ru/online-services/for_citizen/199pass_mon,"Результат оказания услуги
Зачисление ребенка в дошкольную организацию на основании заключенного договора между дошкольной организацией и одним из родителей или законным представителем ребенка либо мотивированный ответ об отказе в оказании государственной услуги.
"
79,Образование,"Прием документов на конкурс по размещению государственного образовательного заказа на подготовку кадров с техническим и профессиональным, послесредним образованием",/cms/ru/online-services/for_citizen/pass73-2_mon,"Результат оказания услуги
Уведомление о принятии документов на конкурс по размещению государственного образовательного заказа на подготовку кадров с техническим и профессиональным, послесредним образованием в организациях образования в произвольной форме либо мотивированный ответ об отказе в оказании государственной услуги.
"
80,Образование,Признание документов о высшем и послевузовском образовании,/cms/ru/online-services/for_citizen/pass_mon,"Результат оказания услуги
Удостоверение о признании документа об образовании.
Дубликат удостоверения о признании документов об образовании.
Мотивированный ответ об отказе в оказании государственной услуги.
"
81,Образование,"Признание документов о среднем, техническом и профессиональном, послесреднем образовании",/cms/ru/online-services/for_citizen/185pass_mon,"Результат оказания услуги
При обращении в Государственную корпорацию:
- удостоверение о признании документов об образовании;
- дубликат удостоверения о признании документов об образовании;
- мотивированный ответ об отказе в оказании государственной услуги.
При обращении на портал:
В случае обращения услугополучателя за результатом оказания государственной услуги на бумажном носителе, результат оказания государственной услуги оформляется в бумажной форме, заверяется печатью и подписью руководителя или уполномоченного на это лица услугодателя.
"
82,Образование,"Присуждение образовательных грантов, а также оказание социальной поддержки обучающимся в организациях высшего и (или) послевузовского образования",/cms/ru/online-services/for_citizen/182pass_mon,"Результат оказания услуги
Электронное свидетельство о присуждении образовательного гранта, а также приказ руководителя ОВПО о назначении стипендии или мотивированный ответ об отказе в оказании государственной услуги.
"
83,Образование,"Регистрация студентов, обучающихся за рубежом",/cms/ru/online-services/for_citizen/6-51pass_mon,"Результат оказания услуги
Уведомление об оказании услуги «Регистрация студентов, обучающихся за рубежом» (о принятии документов для регистрации информации в ИС НОБД и дальнейшей отправки данных для назначения ОСМС), либо мотивированным ответ об отказе.
"
84,Трудоустройствоизанятость,Аккредитация местных спортивных федераций,/cms/ru/online-services/for_citizen/mks_657,"Результат оказания услуги
Свидетельство об аккредитации спортивной федерации, переоформленное свидетельство об аккредитации спортивной федерации, дубликат свидетельства об аккредитации спортивной федерации либо мотивированный ответ об отказе в оказании государственной услуги.
На портале -  уведомление о готовности результата государственной услуги, удостоверенное электронной цифровой подписью уполномоченного должностного лица, для получения результата оказания государственной услуги.
"
85,Трудоустройствоизанятость,Аккредитация республиканских и региональных спортивных федераций,/cms/ru/online-services/for_citizen/pass505_adsfk,"Результат оказания услуги
Свидетельство об аккредитации спортивной федерации, переоформленное свидетельство об аккредитации спортивной федерации, дубликат свидетельства об аккредитации спортивной федерации либо мотивированный ответ об отказе в оказании государственной услуги.
На портале - направляется уведомление о готовности результата государственной услуги, удостоверенное электронной цифровой подписью уполномоченного должностного лица, для получения результата оказания государственной услуги.
"
86,Трудоустройствоизанятость,Выдача дубликата сертификата о прохождении тестирования,/cms/ru/online-services/for_citizen/pass_25_08_mdgs,"Результат оказания услуги
Дубликат сертификата.
"
87,Трудоустройствоизанятость,Выдача сведений о совершении лицом коррупционного преступления,/cms/ru/online-services/for_citizen/pass29_gp,"Результат оказания услуги
Выдача сведений о совершении лицом коррупционного преступления.
Уведомление со сведениями о наличии уголовного дела, возбужденного по коррупционным статьям, по которому не принято окончательное процессуальное решение.
"
88,Трудоустройствоизанятость,Выплата пожизненного ежемесячного материального обеспечения спортсменам и тренерам,/cms/ru/online-services/for_citizen/pass506_adsfk,"Результат оказания услуги
Уведомление о выплате пожизненного материального обеспечения услугополучателю либо мотивированный ответ об отказе в оказании государственной услуги.
На портале – уведомление о готовности результата государственной услуги, удостоверенное электронной цифровой подписью уполномоченного должностного лица, для получения в Государственной корпорации результата государственной услуги.
"
89,Трудоустройствоизанятость,Запись на тестирование на оценку личных качеств,/cms/ru/online-services/for_citizen/pass_25_10_mdgs,"Результат оказания услуги
Расписка о приеме заявления.
"
90,Трудоустройствоизанятость,Запрос личного дела,/cms/ru/online-services/for_citizen/pass_25_09_mdgs,"Результат оказания услуги
Данные личного дела из БД ИИС «е-Кызмет».
"
91,Трудоустройствоизанятость,Информация о социальных отчислениях обязательного социального страхования,/cms/ru/online-services/for_citizen/pass171-6_mtszn,"Результат оказания услуги
Информация о состоянии и движении социальных отчислений.
"
92,Трудоустройствоизанятость,Компенсационная выплата членам сборных команд Республики Казахстан по видам спорта (национальных сборных команд по видам спорта) при получении ими спортивных травм и увечий на международных спортивных соревнованиях,/cms/ru/online-services/for_citizen/pass_mks02501008,"Результат оказания услуги
Уведомление о компенсационной выплате услугополучателю либо мотивированный ответ об отказе в оказании государственной услуги.
На портале – уведомление о готовности результата государственной услуги, удостоверенное электронной цифровой подписью уполномоченного должностного лица, для получения в Государственной корпорации результата государственной услуги.
"
93,Трудоустройствоизанятость,"Оказание содействия лицам, ищущим работу",/cms/ru/online-services/for_citizen/pass177_mtszn,"Результат оказания услуги
Выдача направления лицам на участие в активных мерах содействия занятости, которая включает в себя:
"
94,Трудоустройствоизанятость,"Оказание содействия лицам, ищущим работу, и безработным",/cms/ru/online-services/for_citizen/pass183_mtczn,"Результат оказания услуги
Уведомление о регистрации в качестве лица, ищущего работу либо мотивированный ответ об отказе в оказании государственной услуги.
"
95,Трудоустройствоизанятость,Поиск вакансий и подача заявления на участие в конкурсе,/cms/ru/online-services/for_citizen/pass_25_07_mdgs,"Результат оказания услуги
Расписка о получении документов;
Заявление о приеме на работу.
"
96,Трудоустройствоизанятость,Поиск вакансий и подача заявления на участие в конкурсе (по новой системе отбора),/cms/ru/online-services/for_citizen/pass_25_07_mdgs_new,"Результат оказания услуги
Расписка о получении документов;
Заявление о приеме на работу.
"
97,Трудоустройствоизанятость,Пособие по случаю потери работы,/cms/ru/online-services/for_citizen/pass155_mtszn,"Результат оказания услуги
Уведомление о назначении (отказе в назначении) социальной выплаты по случаю потери работы.
На портале, портале ЭБТ: электронное уведомление о назначении (отказе в назначении) социальной выплаты по случаю потери работы, удостоверенное ЭЦП руководителя филиала Фонда, направленное в ""личный кабинет"" заявителя на портал, портал ЭБТ.
При оказании через проактивную услугу: Sms-оповещение на мобильный телефон заявителя.
"
98,Трудоустройствоизанятость,Предоставление информации о регистрации в качестве безработного,/cms/ru/online-services/for_citizen/pass190-3_mtszn,"Результат оказания услуги
Информация о регистрации в качестве безработного.
"
