,category,service,link,info
121,Социальноеобеспечение,Оформление документов на обеспечение лиц с инвалидностью протезно-ортопедической помощью,/cms/ru/online-services/for_citizen/pass163_mtszn,"Результат оказания услуги
Уведомление об оформлении документов на предоставление лицам с инвалидностью протезно-ортопедической помощи либо мотивированный отказ в оказании государственной услуги.
Госкорпорация информирует заявителя о принятом решении посредством передачи смс-уведомления на абонентское устройство заявителя.
При обращении через веб-портал, результат оказания государственной услуги направляется в ""личный кабинет"" заявителя в форме электронного документа, подписанного электронной цифровой подписью уполномоченного лица.
"
122,Социальноеобеспечение,Оформление документов на обеспечение лиц с инвалидностью специальными средствами передвижения,/cms/ru/online-services/for_citizen/pass01_mtszn,"Результат оказания услуги
Уведомление об оформлении документов на предоставление лицам с инвалидностью специальных средств передвижения либо мотивированный отказ в оказании государственной услуги.
Госкорпорация информирует заявителя о принятом решении посредством передачи смс-уведомления на абонентское устройство заявителя.
При обращении через веб-портал, результат оказания государственной услуги направляется в ""личный кабинет"" заявителя в форме электронного документа, подписанного электронной цифровой подписью уполномоченного лица.
"
123,Социальноеобеспечение,Оформление документов на обеспечение лиц с инвалидностью техническими-вспомогательными (компенсаторными) средствами,/cms/ru/online-services/for_citizen/pass02_mtszn,"Результат оказания услуги
Уведомление об оформлении документов на предоставление лицам с инвалидностью технических вспомогательных (компенсаторных) средств либо мотивированный отказ в оказании государственной услуги.
Госкорпорация информирует заявителя о принятом решении посредством передачи смс-уведомления на абонентское устройство заявителя.
При обращении через веб-портал, результат оказания государственной услуги направляется в «личный кабинет» заявителя в форме электронного документа, подписанного электронной цифровой подписью уполномоченного лица.
"
124,Социальноеобеспечение,Оформление документов на обеспечение лиц с инвалидностью услугами специалиста жестового языка для лиц с инвалидностью по слуху,/cms/ru/online-services/for_citizen/pass167-2_mtszn,"Результат оказания услуги
Уведомление об оформлении документов на предоставление лицам с инвалидностью услуг специалиста жестового языка либо мотивированный отказ в оказании государственной услуги.
Госкорпорация информирует заявителя о принятом решении посредством передачи смс-уведомления на абонентское устройство заявителя.
При обращении через веб-портал, результат оказания государственной услуги направляется в ""личный кабинет"" заявителя в форме электронного документа, подписанного электронной цифровой подписью уполномоченного лица.
"
125,Социальноеобеспечение,"Оформление документов на обеспечение услугами индивидуального помощника лиц с инвалидностью первой группы, имеющих затруднение в передвижении",/cms/ru/online-services/for_citizen/pass167_mtszn,"Результат оказания услуги
Уведомление об оформлении документов на предоставление лицам с инвалидностью первой группы услуг индивидуального помощника.
Госкорпорация информирует заявителя о принятом решении посредством передачи смс-уведомления на абонентское устройство сотовой связи заявителя.
При обращении через веб-портал, результат оказания государственной услуги направляется в «личный кабинет» заявителя в форме электронного документа, подписанного электронной цифровой подписью уполномоченного лица.
"
126,Социальноеобеспечение,Оформление документов на оказание специальных социальных услуг в медико-социальных учреждениях (организациях),/cms/ru/online-services/for_citizen/pass170_mtszn,"Результат оказания услуги
Уведомление об оформлении документов в произвольной форме с указанием срока оказания государственной услуги, или мотивированный ответ об отказе в оказании государственной услуги.
При обращении на портал результат оказания государственной услуги направляется услугополучателю в ""личный кабинет"" в форме электронного документа, удостоверенного ЭЦП должностного лица услугодателя.
"
127,Социальноеобеспечение,Оформление документов на оказание специальных социальных услуг в условиях ухода на дому,/cms/ru/online-services/for_citizen/pass171_mtszn,"Результат оказания услуги
Уведомление об оформлении документов в произвольной форме с указанием срока оказания государственной услуги, или мотивированный ответ об отказе в оказании государственной услуги.
При обращении на портал результат оказания государственной услуги направляется услугополучателю в ""личный кабинет"" в форме электронного документа, удостоверенного ЭЦП должностного лица услугодателя.
"
128,Социальноеобеспечение,Получение справки о пенсионных отчислениях,/cms/ru/online-services/for_citizen/pass160_mtszn,"Результат оказания услуги
Выдача информации о поступлении и движении средств вкладчика единого накопительного пенсионного фонда.
"
129,Социальноеобеспечение,Получение справки о подтверждении инвалидности,/cms/ru/online-services/for_citizen/e_016,"Результат оказания услуги
Получение справки о подтверждении инвалидности в pdf-формате.
"
130,Социальноеобеспечение,Получения пособия по потери кормильца,/cms/ru/online-services/for_citizen/pass00703005_mtszn,"Результат оказания услуги
Уведомление о назначении (об отказе в назначении) пособий.
На портале уведомление о назначении государственного социального пособия по случаю потери кормильца, а также информация о назначении государственного социального пособия по случаю потери кормильца направляется в ""личный кабинет"" услугополучателя в форме электронного документа, удостоверенного электронной цифровой подписью уполномоченного лица услугодателя.
Государственная корпорация информирует услугополучателя о принятом решении посредством передачи sms-оповещения на мобильный телефон услугополучателя.
При оказании услуги через проактивную услугу результат оказания услуги предоставляется посредством sms-оповещения на мобильный телефон услугополучателя.
"
131,Социальноеобеспечение,Пособие многодетным,/cms/ru/online-services/for_citizen/mtczn_00402014,"Результат оказания услуги
Уве­дом­ле­ние в «лич­ный ка­би­нет» или sms-опо­ве­ще­ния на мо­биль­ный те­ле­фон услу­го­по­лу­ча­те­ля о на­зна­че­нии по­со­бия ли­бо (или) мо­ти­ви­ро­ван­ный от­каз в ока­за­нии го­су­дар­ствен­ной услу­ги.
"
132,Социальноеобеспечение,Пособие по потере кормильца,/cms/ru/online-services/for_citizen/pass196_mtszn,"Результат оказания услуги
Уведомление о назначении (отказе в назначении) социальной выплаты по случаю потери кормильца.
На портале: электронное уведомление о назначении (отказе в назначении) социальной выплаты по случаю потери кормильца, удостоверенное ЭЦП руководителя филиала Фонда, направленное в ""личный кабинет"" заявителя на портал.
При оказании через проактивную услугу: Sms-оповещение на мобильный телефон заявителя.
"
133,Социальноеобеспечение,"Предоставление мер господдержки ""с дипломом в село""",/cms/ru/online-services/for_citizen/pass180_msh,"Результат оказания услуги
Уведомление услугополучателя на Портале о необходимости заключения Соглашения о предоставлении мер социальной поддержки специалистам в области здравоохранения, образования, социального обеспечения, культуры, спорта и агропромышленного комплекса, государственным служащим аппаратов акимов сел, поселков, сельских округов, прибывшим для работы и проживания в сельские населенные пункты на Портале, о постановке на учет и очередность или мотивированный отказ в предоставлении мер социальной поддержки.
"
134,Социальноеобеспечение,Прием документов в ДЮСШ,/cms/ru/online-services/for_citizen/pass73-4_mks,"Результат оказания услуги
Копия заявления с отметкой о принятии с указанием даты и фамилии сотрудника канцелярии услугодателя, мотивированный ответ об отказе в оказании государственной услуги.
На портале – уведомление о принятии документов услугополучателю либо мотивированный ответ об отказе в оказании государственной услуги, удостоверенное электронной цифровой подписью уполномоченного лица услугодателя.
"
135,Социальноеобеспечение,Сервис получения информации о назначении пособий и пенсионных выплат,/cms/ru/online-services/for_citizen/P605_mtszn,"Результат оказания услуги
Информация о назначении пособий и пенсионных выплат.
"
136,Социальноеобеспечение,Установление инвалидности,/cms/ru/online-services/for_citizen/pass159_mtszn,"Результат оказания услуги
Электронная через портал, удостоверенные ЭЦП уполномоченного лица услугодателя, направляются в ""личный кабинет"" услугополучателя:
Бумажная у услугодателя по требованию услугополучателя или его представителя.
"
137,"Гражданство,миграцияииммиграция",Включение в региональную квоту приема кандасов,/cms/ru/online-services/for_citizen/pass179-1_mtszn,"Результат оказания услуги
Решение о включении в региональную квоту приема кандасов либо об отказе.
"
138,"Гражданство,миграцияииммиграция",Включение в региональную квоту приема переселенцев,/cms/ru/online-services/for_citizen/pass179_mtszn,"Результат оказания услуги
Решение о включении в региональную квоту приема переселенцев либо об отказе.
"
139,"Гражданство,миграцияииммиграция",Временная регистрация по месту временного пребывания (проживания) граждан Республики Казахстан,/cms/ru/online-services/for_citizen/reg_grazhdan,"Результат оказания услуги
Внесение сведений в информационную систему ""Регистрационный пункт ""Документирование и регистрация населения"" (ИС РП ДРН) об адресе регистрации по месту постоянного жительства, а при временной регистрации – об адресе временного пребывания.
При обращении на портал результат оказания государственной услуги направляется в ""личный кабинет"" услугополучателя в виде уведомления о регистрации по месту жительства.
"
140,"Гражданство,миграцияииммиграция",Выдача архивных справок,/cms/ru/online-services/for_citizen/pass462_mki,"Результат оказания услуги
Архивная справка, копия архивного документа или архивная выписка по подтверждению сведений социально-правового характера, а также ответы об отсутствии на государственном хранении у услугодателя запрашиваемых документов (сведений) на государственном хранении, направлении запроса по принадлежности в другой государственный или ведомственный архив либо мотивированный ответ об отказе в оказании государственной услуги.
"
141,"Гражданство,миграцияииммиграция","Выдача, восстановление или продление на территории Республики Казахстан иностранцам и лицам без гражданства виз на право выезда из Республики Казахстан и въезда в Республику Казахстан",/cms/ru/online-services/for_citizen/pass597_mvd,"Результат оказания услуги
Через услугодателя виза на въезд/выезд в/из Республики Казахстан либо ответ об отказе в оказании государственной услуге.
На портале виза в форме электронного документа.
"
142,"Гражданство,миграцияииммиграция",Выдача или продление справки иностранцу или лицу без гражданства о соответствии квалификации для самостоятельного трудоустройства,/cms/ru/online-services/for_citizen/mz_166_1,"Результат оказания услуги
Справка о соответствии квалификации для самостоятельного трудоустройства, либо мотивированный ответ об отказе в оказании государственной услуги.
"
143,"Гражданство,миграцияииммиграция",Выдача/продление виз,/cms/ru/online-services/for_citizen/pass540_mid,"Результат оказания услуги
Виза на въезд в Республику Казахстан либо ответ об отказе в оказании государственной услуги.
"
144,"Гражданство,миграцияииммиграция","Выдача, продление и отзыв разрешения трудовому иммигранту",/cms/ru/online-services/for_citizen/38-1_mvd,"Результат оказания услуги
Выдача и продление разрешения трудовому иммигранту либо мотивированный отказ в оказании государственной услуги.
Форма предоставления результата государственной услуги: электронная и (или) бумажная.
"
145,"Гражданство,миграцияииммиграция",Государственная регистрация смерти за рубежом,/cms/ru/online-services/for_citizen/pass33-8_mid,"Результат оказания услуги
Свидетельство о смерти либо мотивированный ответ об отказе в оказании государственной услуги.
"
146,"Гражданство,миграцияииммиграция","Представление сведений, подтверждающих регистрацию по постоянному месту жительства в населенном пункте приграничной территории",/cms/ru/online-services/for_citizen/pass4005_mvd,"Результат оказания услуги
Выдача сведений, подтверждающих регистрацию по постоянному месту жительства в населенном пункте приграничной территории в электронном виде.
"
147,"Гражданство,миграцияииммиграция",Присвоение или продление статуса кандаса,/cms/ru/online-services/for_citizen/2F30_mzsr,"Результат оказания услуги
При присвоении статуса кандаса – выдача удостоверения кандаса, в случае продления статуса кандаса – решение местного исполнительного органа.
Государственная корпорация обеспечивает хранение документов, в течение 1 года в информационной системе Государственной корпорации.
По запросу заявителя работник Государственной корпорации выдает ранее полученное от местного исполнительного органа удостоверение кандаса, выгрузив из информационной системы Государственной корпорации.
"
148,"Гражданство,миграцияииммиграция","Проверка наличия запрета на выезд за рубеж по реестру должников, которым ограничен выезд за рубеж и реестру должников по исполнительным производствам",/cms/ru/online-services/for_citizen/services_sr14,"Результат оказания услуги
"
149,"Гражданство,миграцияииммиграция",Прописка по месту жительства,/cms/ru/online-services/for_citizen/pass001_mvd,"Результат оказания услуги
Внесение сведений в информационную систему ""Регистрационный пункт ""Документирование и регистрация населения"" (ИС РП ДРН) об адресе регистрации по месту постоянного жительства, а при временной регистрации – об адресе временного пребывания.
При обращении на портал результат оказания государственной услуги направляется в ""личный кабинет"" услугополучателя в виде уведомления о регистрации по месту жительства.
"
150,"Гражданство,миграцияииммиграция",Разрешение иностранцам на временное проживание в РК,/cms/ru/online-services/for_citizen/00203002_mvd,"Результат оказания услуги
Выдача разрешения на временное проживание в Республике Казахстан либо мотивированный ответ об отказе в оказании государственной услуги.
"
